{
  "schema_version": "1.0.0",
  "artifact_id": "art_feature_surface_inventory_T115500Z",
  "type": "feature-inventory",
  "worker_id": "feature-surface-inventory",
  "title": "Feature surface inventory",
  "summary": "Inventoried user-facing features from app/ routes.",
  "entries": [
    {
      "id": "ft-dashboard",
      "entry_kind": "feature",
      "statement": "Dashboard aggregates household financial health.",
      "source_paths": [
        "app/dashboard/",
        "lib/dashboard/"
      ]
    },
    {
      "id": "ft-jars",
      "entry_kind": "feature",
      "statement": "Jar setup, review queue, history, and per-jar detail.",
      "source_paths": [
        "app/jars/",
        "lib/jars/"
      ]
    },
    {
      "id": "ft-accounts",
      "entry_kind": "feature",
      "statement": "Accounts including savings and credit cards with installments/billing.",
      "source_paths": [
        "app/accounts/",
        "lib/savings/"
      ]
    },
    {
      "id": "ft-goals",
      "entry_kind": "feature",
      "statement": "Goals with cashflow direction support.",
      "source_paths": [
        "app/goals/"
      ]
    },
    {
      "id": "ft-assets",
      "entry_kind": "feature",
      "statement": "Assets including crypto asset class.",
      "source_paths": [
        "app/assets/",
        "lib/assets/"
      ]
    },
    {
      "id": "ft-onboarding",
      "entry_kind": "feature",
      "statement": "Multi-step onboarding: members, money, debts, assets, goals, insights.",
      "source_paths": [
        "app/onboarding/"
      ]
    },
    {
      "id": "ft-insights",
      "entry_kind": "feature",
      "statement": "AI insights foundation and scheduler cron migrations.",
      "source_paths": [
        "lib/insights/",
        "supabase/migrations/"
      ]
    },
    {
      "id": "ft-decision-tools",
      "entry_kind": "feature",
      "statement": "Decision tools surface for household choices.",
      "source_paths": [
        "app/decision-tools/"
      ]
    }
  ],
  "status": "ready",
  "created_at": "2026-08-01T11:57:28Z",
  "trace": {
    "orchestration_id": "art_orch_run_full_20260801T115500Z",
    "plan_id": "art_plan_run_full_20260801T115500Z",
    "task_id": "art_task_feature-surface-inventory",
    "run_id": "art_run_feature-surface-inventory",
    "goal_id": "art_goal_family_finances_full_re"
  },
  "extensions": {
    "pipeline": "product-re",
    "run_id": "run_full_20260801T115500Z"
  }
}
