{
  "schema_version": "1.0.0",
  "artifact_id": "art_domain_discovery_T122000Z",
  "type": "knowledge-notes",
  "worker_id": "domain-discovery",
  "title": "Domain model discovery",
  "summary": "Discovered domain entities and bounded contexts from schema and docs. Discover only.",
  "entries": [
    {
      "id": "dom-household",
      "statement": "Entity Household: name, currency, locale, timezone, assumptions, created_by.",
      "source_paths": [
        "supabase/migrations/00002_core_schema.sql",
        "supabase/migrations/00008_household_assumptions_settings.sql"
      ],
      "entry_kind": "entity"
    },
    {
      "id": "dom-member",
      "statement": "Entity Member: role partner|admin, is_active; linked to auth user.",
      "source_paths": [
        "supabase/migrations/00002_core_schema.sql"
      ],
      "entry_kind": "entity"
    },
    {
      "id": "dom-invitation",
      "statement": "Entity Invitation: status pending|accepted|revoked|expired.",
      "source_paths": [
        "supabase/migrations/00002_core_schema.sql"
      ],
      "entry_kind": "entity"
    },
    {
      "id": "dom-account",
      "statement": "Entity Account: types cash/checking/savings/ewallet/brokerage/credit_card/other; archive.",
      "source_paths": [
        "supabase/migrations/00002_core_schema.sql"
      ],
      "entry_kind": "entity"
    },
    {
      "id": "dom-transaction",
      "statement": "Entity Transaction: income|expense|transfer; cleared|pending.",
      "source_paths": [
        "supabase/migrations/00002_core_schema.sql"
      ],
      "entry_kind": "entity"
    },
    {
      "id": "dom-category",
      "statement": "Entity Category: income|expense; system + household-scoped.",
      "source_paths": [
        "supabase/migrations/00002_core_schema.sql"
      ],
      "entry_kind": "entity"
    },
    {
      "id": "dom-recurring",
      "statement": "Entity RecurringRule: weekly/monthly templates.",
      "source_paths": [
        "supabase/migrations/00002_core_schema.sql"
      ],
      "entry_kind": "entity"
    },
    {
      "id": "dom-asset",
      "statement": "Entity Asset: classes incl. crypto; qty/price history; cashflows.",
      "source_paths": [
        "supabase/migrations/00002_core_schema.sql",
        "supabase/migrations/00012_add_crypto_asset_class.sql"
      ],
      "entry_kind": "entity"
    },
    {
      "id": "dom-liability",
      "statement": "Entity Liability/Debt: mortgage/loan types; repayment schedules.",
      "source_paths": [
        "supabase/migrations/00002_core_schema.sql",
        "lib/debts/"
      ],
      "entry_kind": "entity"
    },
    {
      "id": "dom-goal",
      "statement": "Entity Goal: types; status active|paused|completed|cancelled.",
      "source_paths": [
        "supabase/migrations/00002_core_schema.sql"
      ],
      "entry_kind": "entity"
    },
    {
      "id": "dom-jar",
      "statement": "Entity Jar: types essential/investment/long_term_saving/education/play/give; archive.",
      "source_paths": [
        "supabase/migrations/00040_rebuild_jars_intent_layer.sql",
        "lib/jars/domain/types.ts"
      ],
      "entry_kind": "entity"
    },
    {
      "id": "dom-jar-intent",
      "statement": "Jar intent layer: plans, rules, review_queue, movements, events, snapshots, close_runs.",
      "source_paths": [
        "supabase/migrations/00040_rebuild_jars_intent_layer.sql",
        "supabase/migrations/00046_jar_final_architecture_foundation.sql"
      ],
      "entry_kind": "entity"
    },
    {
      "id": "dom-savings",
      "statement": "Entity SavingsAccount: bank/third_party; status lifecycle; withdrawals; maturity actions.",
      "source_paths": [
        "supabase/migrations/00039_savings_feature.sql",
        "lib/savings/types.ts"
      ],
      "entry_kind": "entity"
    },
    {
      "id": "dom-installment",
      "statement": "Entity InstallmentPlan: active|completed|cancelled; billing items.",
      "source_paths": [
        "supabase/migrations/00014_credit_card_installments.sql"
      ],
      "entry_kind": "entity"
    },
    {
      "id": "dom-scenario",
      "statement": "Entity Scenario: draft|saved|archived (decision tools).",
      "source_paths": [
        "supabase/migrations/00002_core_schema.sql",
        "app/decision-tools/"
      ],
      "entry_kind": "entity"
    },
    {
      "id": "dom-bounded-ledger",
      "statement": "Bounded context Real Ledger: accounts, transactions, assets, liabilities, savings.",
      "source_paths": [
        "docs/DOMAIN_MODEL.md"
      ],
      "entry_kind": "bounded-context"
    },
    {
      "id": "dom-bounded-jars",
      "statement": "Bounded context Virtual Jars: jars, movements, review queue, month close.",
      "source_paths": [
        "docs/JAR_FINAL_ARCHITECTURE.md",
        "lib/jars/domain/"
      ],
      "entry_kind": "bounded-context"
    },
    {
      "id": "dom-bounded-tenancy",
      "statement": "Bounded context Household tenancy & auth.",
      "source_paths": [
        "lib/server/household.ts",
        "app/auth/",
        "app/login/"
      ],
      "entry_kind": "bounded-context"
    }
  ],
  "status": "ready",
  "created_at": "2026-08-01T12:22:43Z",
  "trace": {
    "orchestration_id": "art_orch_run_business_discovery_20260801T122000Z",
    "plan_id": "art_plan_run_business_discovery_20260801T122000Z",
    "task_id": "art_task_domain-discovery",
    "run_id": "art_run_domain-discovery",
    "goal_id": "art_goal_business_discovery"
  },
  "extensions": {
    "stage": "business-discovery",
    "pipeline": "product-re",
    "run_id": "run_business_discovery_20260801T122000Z",
    "redesign": false,
    "specification": false
  }
}
