{
  "schema_version": "1.0.0",
  "artifact_id": "art_requirement_generator_T115500Z",
  "type": "requirement-spec",
  "worker_id": "requirement-generator",
  "title": "Requirements",
  "summary": "Derived requirements from features and business rules (discover-only).",
  "entries": [
    {
      "id": "req-jar-isolation",
      "requirement_id": "REQ-JAR-001",
      "entry_kind": "requirement",
      "statement": "System SHALL keep jar allocations independent from real account ledger balances.",
      "source_paths": [
        "artifacts/business/",
        "artifacts/features/"
      ]
    },
    {
      "id": "req-rls",
      "requirement_id": "REQ-HH-001",
      "entry_kind": "requirement",
      "statement": "System SHALL enforce household-scoped access via RLS for all member data.",
      "source_paths": [
        "artifacts/business/",
        "supabase/migrations/"
      ]
    },
    {
      "id": "req-onboard",
      "requirement_id": "REQ-ONB-001",
      "entry_kind": "requirement",
      "statement": "System SHALL provide multi-step onboarding covering members, money baselines, and first goal.",
      "source_paths": [
        "artifacts/features/",
        "app/onboarding/"
      ]
    }
  ],
  "status": "ready",
  "created_at": "2026-08-01T11:57:28Z",
  "trace": {
    "orchestration_id": "art_orch_run_full_20260801T115500Z",
    "plan_id": "art_plan_run_full_20260801T115500Z",
    "task_id": "art_task_requirement-generator",
    "run_id": "art_run_requirement-generator",
    "goal_id": "art_goal_family_finances_full_re"
  },
  "extensions": {
    "pipeline": "product-re",
    "run_id": "run_full_20260801T115500Z"
  }
}
