{
  "schema_version": "1.0.0",
  "artifact_id": "art_out_product_re_gap_report",
  "type": "product-re-gap",
  "worker_id": "product-re-gap-report",
  "title": "Product RE Gap Report output",
  "summary": "Synthesize coverage gaps across ingest and transform Product RE outputs. Discover only \u2014 do not redesign.",
  "entries": [
    {
      "id": "gap-savings-funding-routes",
      "severity": "medium",
      "statement": "Savings-account-to-jar funding routes are mentioned but not fully inventoried in artifacts/features/.",
      "source_paths": [
        "artifacts/features/",
        "artifacts/product-architecture/",
        "docs/DOMAIN_MODEL.md"
      ],
      "folder_mirror": "artifacts/gaps/"
    }
  ],
  "status": "ready",
  "created_at": "2026-08-01T12:00:00Z",
  "trace": {
    "orchestration_id": "art_product_re_orchestration",
    "plan_id": "art_product_re_plan",
    "task_id": "art_task_product_re_gap_report",
    "run_id": "art_run_product_re_gap_report",
    "goal_id": "art_product_re_goal"
  },
  "extensions": {
    "pipeline": "product-re",
    "role_alias": "product-re-gap-report",
    "redesign": false,
    "produces": [
      "gaps"
    ]
  }
}
